{
  "consumer_profile": "adult_ai_influencer_template",
  "schema_version": "adult_ai_influencer_template_contract.v1",
  "contract_version": "1.2",
  "source": {
    "repo": "nakajang11/Video_Template",
    "commit": "1444507ebb46be94ce73515740ba6cb17bf398fb",
    "job_id": "shotstack_basic"
  },
  "template": {
    "template_id": "A-7_trend_single:shotstack_basic",
    "template_type": "A-7_trend_single",
    "supported_content_types": [],
    "renderer": "shotstack",
    "aspect_ratio": "9:16",
    "duration_seconds": 3.0,
    "precompose_required": false
  },
  "slots": [
    {
      "slot_id": "global.audio.source",
      "scene_id": null,
      "kind": "audio",
      "media_kind": "audio",
      "required": true,
      "fill_strategy": "reuse_source_trend_video",
      "token_ref": "{{slot.global.audio.source}}",
      "prompt_file": null,
      "generation_policy": {
        "model_route": null,
        "prompt_file": null,
        "renderer_use": "source_audio"
      },
      "approval_policy": {
        "requires_slot_approval": false,
        "approval_type": "not_required"
      },
      "renderer_binding": {
        "merge_key": "SOURCE_AUDIO_MP3",
        "source_file": "source_audio.mp3"
      },
      "validation": {
        "warnings": [],
        "blocking": []
      }
    },
    {
      "slot_id": "scene_001.media.startframe",
      "scene_id": "scene_001",
      "kind": "media",
      "media_kind": "image",
      "required": true,
      "fill_strategy": "generate_startframe",
      "token_ref": "{{slot.scene_001.media.startframe}}",
      "prompt_file": "scene_001_startframe_image_prompt.md",
      "generation_policy": {
        "model_route": "nano banana2",
        "prompt_file": "scene_001_startframe_image_prompt.md",
        "renderer_use": "startframe_generation"
      },
      "approval_policy": {
        "requires_slot_approval": true,
        "approval_type": "post_template_slot"
      },
      "renderer_binding": {
        "role": "startframe_input",
        "prompt_file": "scene_001_startframe_image_prompt.md"
      },
      "validation": {
        "warnings": [],
        "blocking": []
      }
    },
    {
      "slot_id": "scene_001.media.main",
      "scene_id": "scene_001",
      "kind": "media",
      "media_kind": "video",
      "required": true,
      "fill_strategy": "generate_video_slot",
      "token_ref": "{{slot.scene_001.media.main}}",
      "prompt_file": "scene_001_video_prompt.md",
      "generation_policy": {
        "model_route": "kling v3",
        "prompt_file": "scene_001_video_prompt.md",
        "renderer_use": "shotstack_final_media"
      },
      "approval_policy": {
        "requires_slot_approval": true,
        "approval_type": "post_template_slot"
      },
      "renderer_binding": {
        "merge_key": "SCENE_001_MEDIA",
        "alias": "SCENE_001"
      },
      "validation": {
        "warnings": [],
        "blocking": []
      }
    },
    {
      "slot_id": "scene_001.text.headline",
      "scene_id": "scene_001",
      "kind": "text",
      "media_kind": null,
      "required": true,
      "fill_strategy": "generate_text",
      "token_ref": "{{slot.scene_001.text.headline}}",
      "prompt_file": null,
      "generation_policy": {
        "model_route": null,
        "prompt_file": null,
        "renderer_use": "editable_text"
      },
      "approval_policy": {
        "requires_slot_approval": true,
        "approval_type": "post_template_slot"
      },
      "renderer_binding": {
        "merge_key": "SCENE_001_HEADLINE",
        "placement": "top"
      },
      "validation": {
        "warnings": [],
        "blocking": []
      }
    }
  ],
  "renderer": {
    "name": "shotstack",
    "renderer_bindings": {
      "renderer": "shotstack",
      "slot_bindings": {
        "global.audio.source": {
          "merge_key": "SOURCE_AUDIO_MP3"
        },
        "scene_001.media.main": {
          "merge_key": "SCENE_001_MEDIA"
        },
        "scene_001.text.headline": {
          "merge_key": "SCENE_001_HEADLINE"
        }
      }
    },
    "precompose_plan": {
      "steps": []
    }
  },
  "validation": {
    "source_contract_validation": {
      "warnings": [],
      "blocking": []
    },
    "tokenized_refs_only": true,
    "paid_generation_performed": false,
    "provider_calls_performed": false,
    "adult_runtime_mutation_performed": false
  }
}